{
  "$ref": "#/definitions/AquaPar",
  "$schema": "http://json-schema.org/draft-07/schema#",
  "definitions": {
    "AquaPar": {
      "additionalProperties": false,
      "description": "Parameters for the Beverton-Holt aquatic mosquito model.",
      "properties": {
        "stochastic": {
         "items": {
            "type": "boolean"
          },
          "type": "array"
        },
        "molt": {
          "items": {
            "type": "number"
          },
          "type": "array"
        },
        "surv": {
          "items": {
            "type": "number"
          },
          "type": "array"
        },
        "K": {
          "items": {
            "type": "number"
          },
          "type": "array"
        },
        "L": {
          "items": {
            "type": "number"
          },
          "type": "array"
        }
      },
      "required": [
        "stochastic",
        "molt",
        "surv",
        "K",
        "L"
      ],
      "type": "object"
    }
  }
}
